{"technique_id":"memory.procedural-promotion","name":"Verified Procedural Memory Promotion","family":"governance","stage":"memory-write","deployment":"deployment-agnostic","lifecycle":"situational","mechanism":"Promotes a reusable workflow only after repeated successful traces are generalized into explicit preconditions, steps, postconditions and rollback instructions.","use_when":["Tasks recur with stable interfaces and objective verification","A successful procedure can be replayed safely in a sandbox"],"avoid_when":["A single success is the only supporting evidence","The environment or permissions differ across future executions"],"parameters":{"minimum_successes":{"type":"integer","allowed":[2,3,5]},"approval_required":{"type":"boolean","allowed":[true,false]}},"expected_effects":["Reduced rediscovery cost for recurring tasks","Auditable reusable procedures with applicability bounds"],"failure_modes":["Overgeneralized procedure runs outside its preconditions","Stored steps reference stale tools or schemas","A successful but unsafe trace is promoted"],"required_evals":["replay success on fresh cases","precondition classification accuracy","safety invariant violations","rollback execution success"],"reindex_required":"partial","risk_class":"high","evidence":{"level":"E2","source_ids":["source-memory-techniques-2026-08"],"links":["https://arxiv.org/abs/2409.07429"]},"freshness":{"checked":"2026-08-12","review":"2026-10-12"}}
