{"technique_id":"runtime.security.isolated-tool-sandbox","name":"Isolated Tool and Code Sandbox","family":"safety","stage":"runtime","deployment":"local-hybrid","lifecycle":"situational","mechanism":"Executes generated code and high-risk tools in a disposable tenant-scoped environment with bounded resources, explicit mounts, no inherited secrets and deny-by-default egress.","use_when":["Agents execute generated code or untrusted parsers","Tenant workloads require a containment boundary from host and peers"],"avoid_when":["All operations are schema-bound remote APIs with no local execution","The sandbox configuration exposes host sockets broad mounts or ambient credentials"],"parameters":{"isolation":{"type":"enum","allowed":["container-hardened","gvisor-kata","microvm","hyper-v"]},"network":{"type":"enum","allowed":["none","allowlist-proxy"]}},"expected_effects":["Reduced blast radius for code execution and parser compromise","Repeatable cleanup and resource enforcement"],"failure_modes":["Writable host mounts or container socket defeat isolation","Shared credentials or caches cross tenant boundaries","Unrestricted egress enables exfiltration or command-and-control"],"required_evals":["escape and host-access probes","secret and metadata-service denial","egress allowlist bypass","resource exhaustion and cleanup"],"reindex_required":"none","risk_class":"high","evidence":{"level":"E2","source_ids":["source-agentic-security-landscape-2026-08"],"links":["https://github.com/kubernetes-sigs/agent-sandbox","https://learn.microsoft.com/en-us/azure/container-apps/sessions"]},"freshness":{"checked":"2026-08-13","review":"2026-10-13"}}
