{"technique_id":"multimodal.fusion.interleaved-document-representation","name":"Interleaved Multimodal Document Representation","family":"fusion","stage":"embedding","deployment":"local-gpu","lifecycle":"situational","mechanism":"Encodes interleaved document text, images and structural segments into linked document- and passage-level representations.","use_when":["Document questions depend on interleaved text and visuals","Both document retrieval and local passage grounding are needed"],"avoid_when":["The workload is page-local text lookup","Long-document dilution and citation localization cannot be measured"],"parameters":{"segment_tokens":{"type":"integer","allowed":[256,512,1024]},"document_pooling":{"type":"enum","allowed":["model-default","hierarchical"]},"passage_rerank_depth":{"type":"integer","allowed":[5,10,20]}},"expected_effects":["Joint retrieval over interleaved multimodal evidence","Document shortlist with local evidence refinement"],"failure_modes":["Holistic vectors hide decisive passages","Long documents dilute rare visual evidence","Document retrieval loses exact citation locality"],"required_evals":["document and passage Recall@k","length-bucketed retrieval","answer and regional citation correctness","index size and latency"],"reindex_required":"full","risk_class":"high","evidence":{"level":"E3","source_ids":["source-multimodal-rag-landscape-2026-08"],"links":["https://aclanthology.org/2026.findings-eacl.83/"]},"freshness":{"checked":"2026-08-12","review":"2026-10-12"}}
