{"technique_id":"multimodal.fusion.ocr-visual","name":"OCR Text and Visual Candidate Fusion","family":"fusion","stage":"retrieval","deployment":"local-hybrid","lifecycle":"situational","mechanism":"Retrieves independently from OCR or parsed text and page-image indexes, then fuses and deduplicates candidates using stable page identities.","use_when":["Corpus mixes clean text scans charts and diagrams","Text and visual lanes have complementary measured errors"],"avoid_when":["One lane consistently dominates every slice","ACL or version filters cannot be enforced identically"],"parameters":{"fusion":{"type":"enum","allowed":["rrf","weighted-score","learned"]},"per_lane_depth":{"type":"integer","allowed":[10,20,50]},"dedupe_key":{"type":"enum","allowed":["page-id","region-id","content-hash"]}},"expected_effects":["Higher recall across mixed document modalities","Graceful degradation when OCR or vision fails"],"failure_modes":["Duplicate page hits crowd out diversity","Score calibration suppresses one useful lane","Different ACL filters leak unauthorized visual pages"],"required_evals":["per-lane and fused Recall@k","OCR-quality and modality slices","deduplication and candidate-depth analysis","latency cost and ACL parity"],"reindex_required":"full","risk_class":"high","evidence":{"level":"E2","source_ids":["source-multimodal-rag-landscape-2026-08"],"links":["https://aclanthology.org/2024.naacl-long.307/"]},"freshness":{"checked":"2026-08-12","review":"2026-10-12"}}
