{"technique_id":"retrieval.security.citation-gate","name":"Fail-closed Citation and Output Security Gate","family":"citation","stage":"context-assembly","deployment":"deployment-agnostic","lifecycle":"situational","mechanism":"Validates source identity, version, authorization, claim support and output policy before returning an answer or permitting downstream agent actions.","use_when":["Answers must be traceable to governed evidence","Unsupported or sensitive output can cause material harm"],"avoid_when":["The application cannot bind generated claims to exact retrieved versions","A verifier model is used as the sole allow or deny authority"],"parameters":{"unsupported_action":{"type":"enum","allowed":["remove-claim","abstain","human-review"]},"sensitive_output":{"type":"enum","allowed":["block","redact","approval"]}},"expected_effects":["Reduced fabricated citation and unsupported-claim delivery","Fail-closed handling of sensitive generated output"],"failure_modes":["Exact citation exists but does not entail the claim","Output policy misses transformed secrets or PII","Model-only fallback bypasses the gate"],"required_evals":["fabricated and mismatched citations","entailment and qualifier preservation","PII and secret transformation probes","verifier outage and model-only fallback denial"],"reindex_required":"none","risk_class":"high","evidence":{"level":"E2","source_ids":["source-agentic-security-landscape-2026-08"],"links":["https://cheatsheetseries.owasp.org/cheatsheets/RAG_Security_Cheat_Sheet.html","https://learn.microsoft.com/en-us/security/zero-trust/sfi/secure-agentic-systems"]},"freshness":{"checked":"2026-08-13","review":"2026-10-13"}}
