{"technique_id":"evaluation.security.adaptive-attack-replay","name":"Adaptive Agent Attack Replay","family":"benchmarking","stage":"evaluation","deployment":"deployment-agnostic","lifecycle":"situational","mechanism":"Generates and manually reviews attacks after inspecting the deployed defense, then repeats them across changed models, tools, message order and multi-turn contexts with fixed state oracles.","use_when":["A defense performs strongly on frozen public suites","Attackers can observe policy responses or adapt payloads"],"avoid_when":["No stable external-state oracle exists","Adaptive generation can reach production credentials or effects"],"parameters":{"adaptation_rounds":{"type":"integer","allowed":[1,2,3,5]},"variants":{"type":"enum","allowed":["encoding-and-order","tool-schema-and-multiturn","full-redteam"]}},"expected_effects":["Reduced benchmark overfitting","Failure discovery under changed attacker strategies"],"failure_modes":["Attack generator optimizes a weak proxy metric","Generated cases leak into final holdouts","No benign controls reveal over-defense"],"required_evals":["attack success by round","benign utility by round","changed tool and model transfer","protected post-tuning holdout"],"reindex_required":"none","risk_class":"high","evidence":{"level":"E2","source_ids":["source-agentic-security-verification-2026-08"],"links":["https://arxiv.org/abs/2602.03117","https://arxiv.org/abs/2510.05244"]},"freshness":{"checked":"2026-08-13","review":"2026-10-13"}}
