{"technique_id":"runtime.google-adk-runtime","name":"Google Agent Development Kit Runtime","family":"orchestration","stage":"runtime","deployment":"deployment-agnostic","lifecycle":"situational","mechanism":"Uses a stateless runner over session, artifact and memory services with event persistence, tools, plugins and sequential, parallel, loop and LLM agents.","use_when":["The application needs modular sessions, events, tools and multi-agent patterns","Google ecosystem integration is useful but model and deployment adapters remain explicit"],"avoid_when":["A very small control loop would avoid the service abstractions","Cross-provider parity, residency or non-Google deployment has not been tested"],"parameters":{"session_service":{"type":"enum","allowed":["in-memory","database","managed"]},"execution_pattern":{"type":"enum","allowed":["single","sequential","parallel","loop"]}},"expected_effects":["Structured event and session lifecycle around a stateless runner","Reusable plugins, tools and multi-agent orchestration patterns"],"failure_modes":["In-memory services are carried into production without durability","Ecosystem-optimized defaults create practical provider or hosting lock-in","Session compaction loses evidence needed for later decisions"],"required_evals":["session persistence and event ordering","provider and deployment parity","compaction fidelity and provenance retention","tool authorization and multi-tenant isolation"],"reindex_required":"none","risk_class":"medium","evidence":{"level":"E2","source_ids":["source-agent-runtime-framework-landscape-2026-08"],"links":["https://github.com/google/adk-python"]},"freshness":{"checked":"2026-08-13","review":"2026-10-13"}}
