{"technique_id":"memory.security.influence-gated-write","name":"Influence-gated Memory Write","family":"write-policy","stage":"memory-write","deployment":"deployment-agnostic","lifecycle":"situational","mechanism":"Routes owner-scoped user, retrieved, tool and model-derived observations into a quarantined candidate store and promotes only policy-compliant lineage-preserving memories after conflict and authority checks.","use_when":["Retrieved evidence or tool output can become durable agent memory","Procedures or preferences can influence future actions"],"avoid_when":["The system persists no cross-run memory","Candidate and canonical stores cannot be isolated"],"parameters":{"promotion":{"type":"enum","allowed":["human","deterministic-policy","policy-plus-review"]},"high_influence_memory":{"type":"enum","allowed":["deny-automatic","require-two-source-review"]}},"expected_effects":["Reduced persistence of poisoned context across sessions","Auditable separation of observations from canonical memory"],"failure_modes":["A summary hides malicious source instructions","Repeated low-risk candidates accumulate into high influence","Deletion misses derived memories and indexes","Merge refresh or consolidation crosses owner scope"],"required_evals":["retrieval-to-memory poisoning","conflict and supersession handling","procedural promotion authority","deletion across source derived and indexed state","owner stamping and fail-closed missing-owner behavior","owner-scoped write merge refresh consolidation and derived-summary paths"],"reindex_required":"partial","risk_class":"high","evidence":{"level":"E2","source_ids":["source-agentic-security-landscape-2026-08","source-agent-memory-evaluation-security-2026","source-memory-operational-baselines-and-tenancy-2026-08"],"links":["https://docs.aws.amazon.com/wellarchitected/latest/agentic-ai-lens/security-design-principles.html","https://genai.owasp.org/download/45674/"]},"freshness":{"checked":"2026-08-17","review":"2026-09-17"}}
