{"technique_id":"evaluation.security.agent-benchmark-suite","name":"Paired Agent Security Benchmark Suite","family":"benchmarking","stage":"evaluation","deployment":"deployment-agnostic","lifecycle":"situational","mechanism":"Runs benign utility and adversarial tool-use cases against a complete agent environment and scores authoritative external state rather than model text alone.","use_when":["Tool-using agents process untrusted data","Security controls must preserve legitimate task utility"],"avoid_when":["Only a chatbot response with no tools data access or memory is evaluated","Benchmark tools and schemas do not resemble the deployed workload"],"parameters":{"development_suite":{"type":"enum","allowed":["agentdojo","injecagent","combined"]},"oracle":{"type":"enum","allowed":["external-state","external-state-plus-human"]}},"expected_effects":["Measured unauthorized effects alongside benign task success","Reproducible injection and exfiltration development baselines"],"failure_modes":["Frozen public attacks are overfit","Refusal is mistaken for security","Text graders disagree with actual tool state"],"required_evals":["benign utility controls","direct and indirect injection","unauthorized external-state effects","protected workload-specific replay"],"reindex_required":"none","risk_class":"high","evidence":{"level":"E3","source_ids":["source-agentic-security-verification-2026-08"],"links":["https://proceedings.neurips.cc/paper_files/paper/2024/hash/97091a5177d8dc64b1da8bf3e1f6fb54-Abstract-Datasets_and_Benchmarks_Track.html","https://aclanthology.org/2024.findings-acl.624/"]},"freshness":{"checked":"2026-08-13","review":"2026-10-13"}}
