{"technique_id":"memory.hybrid-read-router","name":"Typed Hybrid Memory Read Router","family":"read-policy","stage":"memory-read","deployment":"deployment-agnostic","lifecycle":"situational","mechanism":"Classifies the memory need and searches only eligible episodic semantic relational or procedural stores before bounded fusion and abstention.","use_when":["Multiple memory types have different retrieval semantics","Privacy scope and temporal validity must filter every read"],"avoid_when":["One small store already provides sufficient recall","Routing errors would hide critical evidence without a fallback"],"parameters":{"max_stores":{"type":"integer","allowed":[1,2,3,4]},"fusion_policy":{"type":"enum","allowed":["priority","rrf","score-normalized"]}},"expected_effects":["Less irrelevant memory injected into context","Type-specific filters and ranking"],"failure_modes":["Router skips the store containing the answer","Scores from incompatible retrievers are fused naively","Retrieved memory violates actor or tenant scope"],"required_evals":["need-detection precision and recall","memory Recall@k by type","irrelevant memory rate","cross-scope leakage tests","equal-budget raw-log BM25 temporal and local-expansion control","exact-identifier fact-tracking multi-hop and event-order slices"],"reindex_required":"none","risk_class":"high","evidence":{"level":"E2","source_ids":["source-memory-techniques-2026-08","source-memory-operational-baselines-and-tenancy-2026-08"],"links":["https://openreview.net/forum?id=wIonk5yTDq","https://aclanthology.org/2025.findings-acl.989/","https://arxiv.org/abs/2608.12888"]},"freshness":{"checked":"2026-08-17","review":"2026-09-17"}}
