{"technique_id":"runtime.deerflow-harness","name":"DeerFlow Super-Agent Harness","family":"orchestration","stage":"runtime","deployment":"local-hybrid","lifecycle":"situational","mechanism":"Provides a full agent harness with planning, subagents, memory, skills, workspaces, channels, gateway APIs and selectable local or isolated sandbox providers.","use_when":["The product needs an integrated research or coding super-agent surface","Gateway, channels, skills and workspace execution would otherwise be assembled separately"],"avoid_when":["The application needs an embeddable minimal runtime library","The deployment would enable host shell access without isolation and tenant controls"],"parameters":{"sandbox_provider":{"type":"enum","allowed":["container","remote","local-trusted-only"]},"channel_surface":{"type":"enum","allowed":["api-only","selected-channels","multi-channel"]}},"expected_effects":["Rapid delivery of an integrated long-horizon agent experience","Shared planning, subagent, memory and workspace conventions"],"failure_modes":["Local sandbox is mistaken for a security boundary","Large integrated surface increases patch and configuration burden","Major-version rewrites create migration and compatibility risk"],"required_evals":["sandbox and host-access threat tests","gateway authentication and tenant-isolation tests","v1 or prior-system migration rehearsal","end-to-end workload cost latency and recovery"],"reindex_required":"none","risk_class":"high","evidence":{"level":"E2","source_ids":["source-agent-runtime-framework-landscape-2026-08"],"links":["https://github.com/bytedance/deer-flow"]},"freshness":{"checked":"2026-08-13","review":"2026-10-13"}}
