{"technique_id":"embedding.multivector.late-interaction","name":"Text Multi-Vector Late Interaction","family":"multivector","stage":"retrieval","deployment":"local-gpu","lifecycle":"situational","mechanism":"Stores token-level passage vectors and computes query-token maximum similarities at retrieval time for fine-grained matching.","use_when":["Single-vector pooling loses local evidence","Retrieval quality justifies larger indexes and scoring cost"],"avoid_when":["Index footprint or query latency is tightly bounded","A cross-encoder over a small dense candidate set already meets gates"],"parameters":{"token_dimension":{"type":"integer","allowed":[64,96,128]},"document_max_tokens":{"type":"integer","allowed":[128,256,512]},"compression":{"type":"enum","allowed":["residual","quantized","none"]}},"expected_effects":["Improved fine-grained query-document interaction","Token-level matching without full cross-encoding"],"failure_modes":["Multi-vector index growth exceeds capacity","Maximum similarity overweights spurious token matches","Compression changes ranking on rare terms"],"required_evals":["Recall@k and nDCG versus dense","index bytes per passage","p50 and p95 scoring latency","token-match error inspection"],"reindex_required":"full","risk_class":"high","evidence":{"level":"E3","source_ids":["source-embedding-landscape-2026-08"],"links":["https://aclanthology.org/2022.naacl-main.272/"]},"freshness":{"checked":"2026-08-12","review":"2026-10-12"}}
