{"technique_id":"chunking.adaptive.mixture","name":"Adaptive or Mixture Chunking","family":"adaptive","stage":"segmentation","deployment":"local-hybrid","lifecycle":"situational","mechanism":"Chooses among multiple chunkers or granularities using document features intrinsic metrics learned selection or query class rather than one global policy.","use_when":["The corpus mixes structurally different document classes","Sufficient labeled replay exists to justify routing complexity"],"avoid_when":["A single simple policy already meets all sliced gates","Selection features drift without monitoring and rollback"],"parameters":{"selection_scope":{"type":"enum","allowed":["document","section","query_class"]},"candidate_set":{"type":"enum","allowed":["fixed_structural","fixed_structural_semantic","multi_granular"]},"fallback":{"type":"enum","allowed":["fixed","structure_aware"]}},"expected_effects":["Per-slice optimization without forcing one chunker","Better fit across heterogeneous corpora"],"failure_modes":["Router overfits visible development cases","Multiple indexes increase cost and operational drift","Selection errors hide behind aggregate metrics"],"required_evals":["paired performance by document and query slice","router selection accuracy","index and ingestion cost","holdout generalization and rollback test"],"reindex_required":"full","risk_class":"high","evidence":{"level":"E3","source_ids":["source-chunking-landscape-2026-08"],"links":["https://aclanthology.org/2025.acl-long.258/","https://aclanthology.org/2025.coling-main.384/","https://arxiv.org/abs/2603.25333"]},"freshness":{"checked":"2026-08-12","review":"2026-10-12"}}
