{"technique_id":"rsi.paired-promotion-gates","name":"Paired Multi-objective Promotion Gates","family":"governance","stage":"improvement","deployment":"deployment-agnostic","lifecycle":"situational","mechanism":"Promotes only candidates that beat the same baseline on paired protected tasks while passing immutable safety regressions and explicit cost latency budgets.","use_when":["An optimizer proposes changes for production consideration","Quality safety and efficiency must not collapse into one scalar"],"avoid_when":["Candidate and baseline use different tasks or environment snapshots","A single successful replay is the only evidence"],"parameters":{"minimum_repeats":{"type":"integer","allowed":[3,5,10]},"decision_rule":{"type":"enum","allowed":["all-hard-gates-plus-delta","pareto-plus-hard-gates"]}},"expected_effects":["Regression-resistant candidate selection","Transparent tradeoffs across quality safety cost and latency"],"failure_modes":["Aggregate gain hides a protected-slice regression","Repeated trials are correlated","Selection set becomes optimization training data"],"required_evals":["paired delta and confidence interval","hard-gate violations by slice","cost and latency Pareto report","independent holdout confirmation"],"reindex_required":"none","risk_class":"high","evidence":{"level":"E2","source_ids":["source-bounded-improvement-techniques-2026-08"],"links":["https://openreview.net/forum?id=RQm2KQTM5r"]},"freshness":{"checked":"2026-08-12","review":"2026-10-12"}}
