{"technique_id":"retrieval.query.rewrite","name":"Intent-Preserving Query Rewriting","family":"rewriting","stage":"retrieval","deployment":"deployment-agnostic","lifecycle":"situational","mechanism":"Transforms conversational or underspecified input into a standalone retrieval query while preserving entities, constraints and exact identifiers.","use_when":["Follow-up questions depend on conversation context","Verbose or ambiguous wording consistently lowers first-stage recall"],"avoid_when":["Exact strings could be mutated without detection","The original query already retrieves the required evidence"],"parameters":{"rewrite_count":{"type":"integer","allowed":[1,2,3]},"identifier_lock":{"type":"boolean","allowed":[true,false]},"fallback":{"type":"enum","allowed":["original-query","union-original","reject-rewrite"]}},"expected_effects":["Less conversational ambiguity","Better retrieval alignment on measured rewrite slices"],"failure_modes":["Semantic drift changes the requested task","Identifiers dates or negation are lost","Prompt injection is propagated into generated queries"],"required_evals":["intent and constraint preservation","Recall@k versus original query","exact-identifier and negation slice","latency token cost and rewrite rejection rate"],"reindex_required":"none","risk_class":"high","evidence":{"level":"E3","source_ids":["source-retrieval-context-landscape-2026-08"],"links":["https://aclanthology.org/2023.emnlp-main.585/","https://aclanthology.org/2023.acl-long.99/"]},"freshness":{"checked":"2026-08-12","review":"2026-10-12"}}
