{"technique_id":"embedding.contract.asymmetric-instructions","name":"Asymmetric Embedding Instruction Contract","family":"dense","stage":"embedding","deployment":"deployment-agnostic","lifecycle":"situational","mechanism":"Pins distinct query and passage prefixes, tokenizer, pooling and normalization as part of the immutable index identity.","use_when":["The encoder was trained with asymmetric retrieval instructions","Multiple services produce queries or passage vectors"],"avoid_when":["The model explicitly documents symmetric encoding","The deployed model card does not specify an instruction contract"],"parameters":{"query_prefix":{"type":"enum","allowed":["query:","model-documented"]},"passage_prefix":{"type":"enum","allowed":["passage:","model-documented"]},"normalization":{"type":"enum","allowed":["l2","model-default"]}},"expected_effects":["Reproducible query-to-passage geometry","Early detection of silent client mismatch"],"failure_modes":["Query and passage prefixes are swapped","Pooling differs between indexing and serving","A model upgrade silently changes tokenization"],"required_evals":["prefix parity matrix","known-neighbor sentinel tests","cross-client vector equivalence","paired retrieval replay"],"reindex_required":"full","risk_class":"high","evidence":{"level":"E2","source_ids":["source-embedding-landscape-2026-08"],"links":["https://aclanthology.org/2024.findings-acl.137/"]},"freshness":{"checked":"2026-08-12","review":"2026-10-12"}}
