{"technique_id":"chunking.semantic.similarity","name":"Semantic Similarity Chunking","family":"semantic","stage":"segmentation","deployment":"local-hybrid","lifecycle":"situational","mechanism":"Embeds sentences or blocks and creates boundaries where adjacent semantic similarity drops below a configured threshold or change-point rule.","use_when":["Topic transitions do not align with visible formatting","Offline compute is available for a measured candidate"],"avoid_when":["A simple structure-aware baseline already meets the gates","Embedding drift would make boundaries operationally unstable"],"parameters":{"boundary_rule":{"type":"enum","allowed":["percentile","gradient","standard_deviation"]},"target_tokens":{"type":"integer","allowed":[256,512,1024]},"embedding_scope":{"type":"enum","allowed":["sentence","paragraph"]}},"expected_effects":["Fewer chunks spanning unrelated topics","Potentially coherent units without document markup"],"failure_modes":["No consistent gain over fixed baselines","Embedding cost and model changes alter boundaries","Semantically related but structurally separate content merges"],"required_evals":["paired Recall@k versus controls","boundary coherence","ingestion compute and latency","answer quality and citation correctness"],"reindex_required":"full","risk_class":"high","evidence":{"level":"E3","source_ids":["source-chunking-landscape-2026-08"],"links":["https://aclanthology.org/2025.findings-naacl.114/"]},"freshness":{"checked":"2026-08-12","review":"2026-10-12"}}
