{"technique_id":"runtime.security.mcp-plugin-admission","name":"MCP and Plugin Admission Control","family":"governance","stage":"runtime","deployment":"deployment-agnostic","lifecycle":"situational","mechanism":"Inventories, pins, scans and approves MCP servers, plugins and tool manifests, then monitors identity, schema, advisories and behavior drift before exposing capabilities to agents.","use_when":["Tools are discovered or updated independently of application releases","Third-party MCP servers or plugins extend runtime authority"],"avoid_when":["The application has a fixed internal tool set compiled into one release","The control plane cannot block unknown or changed manifests"],"parameters":{"admission":{"type":"enum","allowed":["manual","signed-allowlist","policy-registry"]},"drift_action":{"type":"enum","allowed":["deny","quarantine"]}},"expected_effects":["Reduced supply-chain and tool-poisoning exposure","Versioned review of the effective capability surface"],"failure_modes":["A trusted name points to a changed server or package","An admitted pinned release contains a reachable implementation vulnerability","Tool descriptions contain hidden instructions","Runtime auto-discovers an unregistered endpoint"],"required_evals":["manifest drift signature and advisory-policy failure","typosquatting and name-collision tests","hidden instruction and schema-change probes","unknown endpoint fail-closed behavior","vulnerable and first-patched release replay when an affected server is adopted"],"reindex_required":"none","risk_class":"high","evidence":{"level":"E2","source_ids":["source-agentic-security-landscape-2026-08","source-runtime-boundary-regression-evidence-2026-08"],"links":["https://genai.owasp.org/2025/12/09/owasp-top-10-for-agentic-applications-the-benchmark-for-agentic-security-in-the-age-of-autonomous-ai/","https://github.com/microsoft/agent-governance-toolkit","https://github.com/advisories/GHSA-49mq-fc6q-3h46","https://github.com/advisories/GHSA-49m4-vp58-wgc9","https://github.com/advisories/GHSA-9hgc-g3w5-67cm"]},"freshness":{"checked":"2026-08-17","review":"2026-09-17"}}
