{"technique_id":"parser.pipeline.marker","name":"Marker PDF Conversion","family":"pipeline","stage":"ingestion","deployment":"local-hybrid","lifecycle":"situational","mechanism":"Converts PDFs to Markdown or structured output using native text and layout models, with OCR and optional LLM-assisted recovery for difficult pages.","use_when":["Local PDF-to-Markdown conversion is the primary need","Scientific PDFs and tables need stronger structure than native extraction"],"avoid_when":["The archive is mostly non-PDF formats","LLM-assisted parsing cannot be allowed or audited"],"parameters":{"ocr_mode":{"type":"enum","allowed":["auto","force","off"]},"llm_assist":{"type":"boolean","allowed":[true,false]},"output_format":{"type":"enum","allowed":["markdown","json","html"]}},"expected_effects":["Readable structured PDF conversion","Selective escalation from native text to OCR or LLM"],"failure_modes":["LLM assistance invents plausible content","Tables or columns are serialized incorrectly","Resource use spikes on scanned documents"],"required_evals":["Markdown structural fidelity","table accuracy","unsupported-content rate with LLM assist","latency and GPU memory by page type"],"reindex_required":"full","risk_class":"high","evidence":{"level":"E2","source_ids":["source-parser-landscape-2026-08"],"links":["https://github.com/datalab-to/marker/blob/master/README.md"]},"freshness":{"checked":"2026-08-12","review":"2026-10-12"}}
