{"technique_id":"parser.vlm.docling","name":"Docling VLM Pipeline","family":"vlm","stage":"ingestion","deployment":"local-gpu","lifecycle":"situational","mechanism":"Renders pages for a vision-language model and converts visual document understanding into structured Docling output, optionally retaining native text signals.","use_when":["Layouts, diagrams, formulas or degraded scans defeat deterministic parsing","Local VLM deployment is required"],"avoid_when":["GPU capacity or latency budget is tight","Unsupported generated structure cannot be independently checked"],"parameters":{"model_preset":{"type":"enum","allowed":["granite_docling","smoldocling","deepseek_ocr"]},"text_mode":{"type":"enum","allowed":["visual","hybrid"]},"resolution_tier":{"type":"enum","allowed":["standard","high"]}},"expected_effects":["Better recovery on visually difficult pages","Unified structured output across visual layouts"],"failure_modes":["Plausible but unsupported text or structure","Model-version drift changes parse output","GPU memory exhaustion on large pages"],"required_evals":["visual text fidelity","formula and table accuracy","unsupported-content rate","GPU latency and memory by page class"],"reindex_required":"full","risk_class":"high","evidence":{"level":"E2","source_ids":["source-parser-landscape-2026-08","source-document-parsing-evidence-2026"],"links":["https://docling-project.github.io/docling/usage/vision_models/"]},"freshness":{"checked":"2026-08-12","review":"2026-10-12"}}
