{"technique_id":"multimodal.routing.query-and-corpus","name":"Query and Corpus Modality Routing","family":"routing","stage":"retrieval","deployment":"deployment-agnostic","lifecycle":"situational","mechanism":"Routes or fans out each query to text visual chart or structured-table lanes using query intent and document modality metadata.","use_when":["Visual processing cost should be selective","Modality labels and route decisions can be logged"],"avoid_when":["Routing recall cannot be measured","A wrong route would irreversibly hide all relevant evidence"],"parameters":{"mode":{"type":"enum","allowed":["hard-route","fan-out","confidence-fallback"]},"fallback":{"type":"enum","allowed":["text","all-lanes","abstain"]},"confidence_threshold":{"type":"number","allowed":[0.5,0.7,0.9]}},"expected_effects":["Lower average multimodal retrieval cost","Specialized handling for chart table and visual questions"],"failure_modes":["Ambiguous queries take the wrong lane","Metadata misclassifies scanned or mixed pages","Router drift changes recall without visible errors"],"required_evals":["route accuracy and oracle-route gap","end-to-end Recall@k by modality","fallback rate and missed-evidence audit","latency and cost by route"],"reindex_required":"none","risk_class":"high","evidence":{"level":"E2","source_ids":["source-multimodal-rag-landscape-2026-08"],"links":["https://aclanthology.org/2025.ijcnlp-long.2/"]},"freshness":{"checked":"2026-08-12","review":"2026-10-12"}}
