{"technique_id":"runtime.durable-checkpoint-ledger","name":"Durable Checkpoint and Side-effect Ledger","family":"orchestration","stage":"runtime","deployment":"deployment-agnostic","lifecycle":"situational","mechanism":"Persists typed run state at safe boundaries and records idempotency keys, authorization consumption and external effects before retry or resume.","use_when":["Runs must survive process failures or long approval delays","Retries can duplicate costly or irreversible effects"],"avoid_when":["The task is short read-only and safely restartable","Only chat history is available while external state cannot be reconciled"],"parameters":{"checkpoint_policy":{"type":"enum","allowed":["every-effect","state-change","adaptive"]},"retry_limit":{"type":"integer","allowed":[0,1,2,3]}},"expected_effects":["Recoverable long-running execution","Reduced duplicate side effects during retries"],"failure_modes":["Checkpoint omits operating-system or remote state","Non-idempotent sink duplicates an accepted action","Schema migration makes pending runs unreadable"],"required_evals":["crash injection recovery correctness","duplicate side-effect rate","checkpoint overhead","old-state migration and resume tests"],"reindex_required":"none","risk_class":"high","evidence":{"level":"E2","source_ids":["source-runtime-techniques-2026-08"],"links":["https://arxiv.org/abs/2604.28138","https://arxiv.org/abs/2608.01710"]},"freshness":{"checked":"2026-08-12","review":"2026-09-12"}}
