{"technique_id":"chunking.contextual.neighbor-expansion","name":"Neighbor Expansion","family":"contextual","stage":"segmentation","deployment":"local-cpu","lifecycle":"situational","mechanism":"Retrieves fine source units and then adds a bounded number of immediately preceding and following units from the same document version.","use_when":["Evidence often spans adjacent prose units","Source order and document-version links are reliable"],"avoid_when":["Adjacent units cross ACL or topic boundaries","Retrieved hits already contain sufficient context"],"parameters":{"neighbors_before":{"type":"integer","allowed":[0,1,2]},"neighbors_after":{"type":"integer","allowed":[0,1,2]},"deduplicate":{"type":"boolean","allowed":[true,false]}},"expected_effects":["Recovered local qualifiers and continuations","No extra embeddings for expanded context"],"failure_modes":["Irrelevant neighbors reduce precision","Expansion crosses structural or access boundaries","Multiple hits produce overlapping duplicate ranges"],"required_evals":["evidence coverage gain","context precision loss","duplicate token rate","authorization and version-integrity tests"],"reindex_required":"full","risk_class":"medium","evidence":{"level":"E3","source_ids":["source-chunking-landscape-2026-08"],"links":["https://aclanthology.org/2025.coling-main.384/"]},"freshness":{"checked":"2026-08-12","review":"2026-10-12"}}
