{"technique_id":"embedding.compression.quantized-index","name":"Quantized Embedding Index","family":"compression","stage":"embedding","deployment":"deployment-agnostic","lifecycle":"situational","mechanism":"Stores reduced-precision or product-quantized vectors and optionally rescoring a larger shortlist with higher-precision vectors.","use_when":["Vector memory or ANN bandwidth is a measured bottleneck","A full-precision champion and paired ranking replay exist"],"avoid_when":["The corpus is small enough for full precision","Rare-term or tail-language losses cannot be measured"],"parameters":{"precision":{"type":"enum","allowed":["float16","int8","binary","product-quantized"]},"oversample":{"type":"integer","allowed":[1,2,4]},"rescore":{"type":"boolean","allowed":[true,false]}},"expected_effects":["Lower index memory and bandwidth","Potentially faster candidate search with bounded rescoring"],"failure_modes":["Quantization changes nearest-neighbor order","Tail languages and hard negatives regress","Index and query precision contracts diverge"],"required_evals":["paired Recall@k and nDCG","language and hard-negative slices","bytes per vector and total index size","p50 and p95 latency"],"reindex_required":"full","risk_class":"high","evidence":{"level":"E2","source_ids":["source-embedding-landscape-2026-08"],"links":["https://aclanthology.org/2022.emnlp-main.54/","https://aclanthology.org/2026.acl-long.482/"]},"freshness":{"checked":"2026-08-12","review":"2026-10-12"}}
